{
  "messageId": "message-CheckCompleted",
  "messageType": "matigr.checking.check-completed",
  "schemaVersion": 1,
  "producer": "Checking",
  "occurredAt": "2026-10-23T04:00:00Z",
  "aggregateType": "Check",
  "aggregateId": "check-appeal-1",
  "aggregateVersion": "3",
  "correlationId": "process-1",
  "causationId": "command-1",
  "payload": {
    "solutionId": "19537a57-dbab-56eb-a167-e04a7b3104fe",
    "materialVersionId": "3be2c5aa-ff91-5af7-8649-edfeebebd0fc",
    "tournamentId": "0344e06b-4ea1-582e-bd91-e832719773f2",
    "teamId": "ce3eb69e-e2b8-5f58-a45c-40c9d71d0031",
    "taskId": "acdc6594-8ac1-5f18-bb65-def577a79950",
    "checkId": "check-appeal-1",
    "kind": "Appeal",
    "reviewRevision": "2",
    "outcome": "Correct",
    "decisionOrigin": "AppealReview",
    "reviewerId": "6b8e3a04-ab14-5bdd-92cc-4a767e67f29b",
    "assignmentId": "assignment-appeal",
    "completedAt": "2026-10-23T04:00:00Z",
    "expectedResultVersion": "1",
    "appealId": "appeal-1",
    "recheckRequestId": "request-1",
    "selectedReviewerId": "6b8e3a04-ab14-5bdd-92cc-4a767e67f29b",
    "resultId": "result-1",
    "baseCheckId": "check-initial-1",
    "publicationId": "publication-base-1"
  }
}
